<?xml version="1.0" ?>
<xs:schema xmlns:xs="http://www.w3.org/2001/XMLSchema">
    <xs:element name="school">
        <xs:complexType>
            <xs:sequence>
                <xs:element ref="student" minOccurs="0" maxOccurs="unbounded"/>
            </xs:sequence>
        </xs:complexType>
        <xs:unique name="unique-id">
            <xs:selector xpath="student"/>
            <xs:field xpath="@id"/>
        </xs:unique>
    </xs:element>

    <xs:element name="student">
        <xs:complexType>
            <xs:sequence>
                <xs:element name="firstName" type="xs:string"/>
                <xs:element name="lastName" type="xs:string"/>
                <xs:element name="birthDate" type="xs:date"/>
                <xs:element name="gender" type="genderTyp"/>
            </xs:sequence>
            <xs:attribute name="id" type="xs:integer" use="required"/>
        </xs:complexType>
    </xs:element>

    <xs:simpleType name="genderTyp">
        <xs:restriction base="xs:string">
            <xs:enumeration value="Male"/>
            <xs:enumeration value="Female"/>
        </xs:restriction>
    </xs:simpleType>
</xs:schema>