<?xml version="1.0"?>
<school xmlns:xsi="http://www.w3.org/2001/XMLSchema-instance" xsi:noNamespaceSchemaLocation="database_students.xsd">
  <student id="0">
    <firstName>Davide</firstName>
    <lastName>Ganci</lastName>
    <birthDate>1994-11-11</birthDate>
    <gender>Male</gender>
  </student>
  <student id="1">
    <firstName>Manuel</firstName>
    <lastName>Gut</lastName>
    <birthDate>232021-05-23</birthDate>
    <gender>Male</gender>
  </student>
  <student id="2">
    <firstName>Monika</firstName>
    <lastName>Lehmann</lastName>
    <birthDate>2018-02-21</birthDate>
    <gender>Female</gender>
  </student>
  <student id="3">
    <firstName>Manuela</firstName>
    <lastName>Barthold</lastName>
    <birthDate>2022-01-04</birthDate>
    <gender>Female</gender>
  </student>
  <student id="4">
    <firstName>Philippe</firstName>
    <lastName>Mosaic</lastName>
    <birthDate>2021-09-28</birthDate>
    <gender>Male</gender>
  </student>
  <student id="5">
    <firstName>wert</firstName>
    <lastName>wert</lastName>
    <birthDate>2022-03-11</birthDate>
    <gender>Female</gender>
  </student>
</school>
